{
  "schemaVersion": "1.0",
  "project": "retest",
  "target": {
    "scope": { "raw": "リソースグループ", "sources": ["P-002"] },
    "subscriptionId": { "raw": "00000000-0000-0000-0000-000000000000", "sources": ["P-001"] },
    "resourceGroup": { "raw": "rg-sample-web-dev", "sources": ["P-003"] },
    "location": { "raw": "東日本", "sources": ["P-004"] }
  },
  "tags": {
    "env": { "raw": "dev", "sources": ["P-027"] },
    "system": { "raw": "sample-web", "sources": ["P-028"] }
  },
  "resources": [
    {
      "id": "R-001",
      "type": "Microsoft.Web/serverFarms",
      "logicalName": "asp-sample-web-dev",
      "designRef": "2. リソース一覧 > No.1",
      "settings": {
        "sku.name": { "raw": "Premium v3 P1v3", "sources": ["P-006"] },
        "kind": { "raw": "Linux", "sources": ["P-007"] }
      }
    },
    {
      "id": "R-002",
      "type": "Microsoft.Web/sites",
      "logicalName": "app-sample-web-dev",
      "designRef": "2. リソース一覧 > No.2",
      "dependsOn": ["R-001"],
      "settings": {
        "serverFarmId": { "raw": "（No.1 のプランを使用）", "sources": ["P-010"] },
        "properties.runtime": { "raw": "ランタイムは別途決定", "sources": ["P-009", "P-031"] },
        "properties.httpsOnly": { "raw": "HTTPS のみ許可", "sources": ["P-020"] },
        "properties.minTlsVersion": { "raw": "1.2", "sources": ["P-021"] },
        "identity.type": { "raw": "有効", "sources": ["P-024"] },
        "properties.siteConfig.virtualNetworkSubnetId": { "raw": "snet-app", "sources": ["P-018"] }
      }
    },
    {
      "id": "R-003",
      "type": "Microsoft.Storage/storageAccounts",
      "logicalName": "stsamplewebdev001",
      "designRef": "2. リソース一覧 > No.3",
      "settings": {
        "sku.name": { "raw": "Standard / LRS", "sources": ["P-012"] },
        "kind": { "raw": "StorageV2", "sources": ["P-013"] },
        "properties.minimumTlsVersion": { "raw": "1.2", "sources": ["P-022"] },
        "properties.allowBlobPublicAccess": { "raw": "無効", "sources": ["P-023"] },
        "properties.publicNetworkAccess": { "raw": "無効", "sources": ["P-030"] }
      }
    },
    {
      "id": "R-004",
      "type": "Microsoft.Network/virtualNetworks",
      "logicalName": "vnet-sample-web-dev",
      "designRef": "2. リソース一覧 > No.4",
      "settings": {
        "properties.addressSpace.addressPrefixes": { "raw": "10.10.0.0/16", "sources": ["P-015"] },
        "properties.subnets[0].name": { "raw": "snet-app", "sources": ["P-018"] },
        "properties.subnets[0].properties.addressPrefix": { "raw": "10.10.1.0/24", "sources": ["P-018"] }
        ,"properties.subnets[1].name": { "raw": "snet-endpoint", "sources": ["P-032"] },
        "properties.subnets[1].properties.addressPrefix": { "raw": "10.10.7.0/24", "sources": ["P-032"] }
      }
    },
    {
      "id": "R-005",
      "type": "Microsoft.Network/privateEndpoints",
      "logicalName": "pe-stsamplewebdev001-blob",
      "designRef": "2. リソース一覧 > No.5",
      "dependsOn": ["R-003", "R-004"],
      "settings": {
        "properties.privateLinkServiceConnections[0].properties.privateLinkServiceId": { "raw": "R-003", "sources": ["P-017"] },
        "properties.subnet.id": { "raw": "snet-endpoint (10.10.7.0/24)", "sources": ["P-032"] }
      }
    },
    {
      "id": "R-006",
      "type": "Microsoft.Network/privateDnsZones",
      "logicalName": "privatelink.blob.core.windows.net",
      "designRef": "3. ネットワーク > private DNS",
      "settings": {
        "zoneName": { "raw": "privatelink.blob.core.windows.net", "sources": ["P-019"] },
        "links": { "raw": "R-004", "sources": ["P-014"] }
      }
    },
    {
      "id": "R-007",
      "type": "Microsoft.Authorization/roleAssignments",
      "logicalName": "rbac-principal1-storage-blob",
      "designRef": "5. RBAC > row 1",
      "settings": {
        "properties.role": { "raw": "ストレージ BLOB データ共同作成者", "sources": ["P-025"] },
        "properties.principal": { "raw": "R-002:identity", "sources": ["P-024"] },
        "properties.scope": { "raw": "R-003", "sources": ["P-011"] }
      }
    },
    {
      "id": "R-008",
      "type": "Microsoft.Authorization/roleAssignments",
      "logicalName": "rbac-principal2-rg-reader",
      "designRef": "5. RBAC > row 2",
      "settings": {
        "properties.role": { "raw": "閲覧者", "sources": ["P-029"] },
        "properties.principal": { "raw": "99999999-8888-7777-6666-555555555555", "sources": ["P-026", "P-033"] },
        "properties.scope": { "raw": "target:resourceGroup", "sources": ["P-003"] }
      }
    }
  ]
}
